{
  "event_id": "e5f6a1b2-c3d4-4e5f-af6a-7b8c9d0e1f2a",
  "raw_event_id": "a1b2c3d4-e5f6-4a1b-8c2d-3e4f5a6b7c8d",
  "schema_version": "1.0",
  "event_source_id": "collector-agent-01",
  "decoy_id": "WEB-001",
  "event_type": "PAGE_VISIT",
  "event_category": "REQUEST",
  "event_subcategory": null,
  "action": "HTTP_GET",
  "outcome": "SUCCESS",
  "observed_at": "2026-10-31T10:15:30.123456+00:00",
  "received_at": "2026-10-31T10:15:30.150000+00:00",
  "normalized_at": "2026-10-31T10:15:30.180000+00:00",
  "source_address": "198.51.100.45",
  "source_port": 54321,
  "source_protocol": "https",
  "source_identity_type": "DIRECT_IP",
  "observed_source_id": "src_profile_9876543210ab",
  "target_service": "WEB_PORTAL",
  "target_protocol": "HTTPS",
  "target_port": 8080,
  "session_id": "decoy_sess_3430c5e63810486c99cff33faad6a50d",
  "interaction_id": "req_a1b2c3d4e5f60101",
  "sequence_number": 1,
  "previous_event_id": null,
  "details": {
    "http": {
      "method": "GET",
      "path": "/login",
      "status_code": 200,
      "user_agent": "Mozilla/5.0 (Windows NT 10.0; Win64; x64) Chrome/120.0.0.0"
    }
  },
  "provenance": {
    "source_type": "CONTROLLED_TEST",
    "environment": "ISOLATED_LAB",
    "source_system": "lab-vm-node-01",
    "collection_method": "FILE_WATCHER",
    "simulation_run_id": "sim_p11_test_run_01"
  },
  "processing": {
    "validation_status": "VALID",
    "normalization_status": "SUCCESS",
    "processing_version": "1.0.0",
    "deduplication_reference": "e3b0c44298fc1c149afbf4c8996fb92427ae41e4649b934ca495991b7852b855"
  }
}
